{"anonymous_loading":{"token":false,"trust_remote_code":false,"use_safetensors":true},"created_at":"2026-08-21T17:59:38Z","image":{"child_digest":"sha256:5266c57be21059bfb407d80dc2f448868a5c2e2dbe7b2aa27780f48b48cbec39","child_media_type":"application/vnd.docker.distribution.manifest.v2+json","config_digest":"sha256:567f38929faa9ddb0a42dae1d969a74633f4c7463871bc714dceef47850cc749","config_media_type":"application/vnd.docker.container.image.v1+json","config_size":30183,"index_digest":null,"index_media_type":null,"layers":[{"digest":"sha256:9cb31e2e37eab1bff50f727e979fcacb509e225fb853433a6fe21d2fb34e6305","media_type":"application/vnd.docker.image.rootfs.diff.tar.gzip","size":29535941},{"digest":"sha256:b95112eaf2836b9c7193858419f6d17933a873c4a2c9227dc497f5e090ea9c87","media_type":"application/vnd.docker.image.rootfs.diff.tar.gzip","size":4636499},{"digest":"sha256:030ef82509363afebdc78482e6f8c07f2bc8b65a45caf082c2a9a621c7deae63","media_type":"application/vnd.docker.image.rootfs.diff.tar.gzip","size":64297624},{"digest":"sha256:72ac9ccfda38d144ef8e3aadbd5851e7fa9aacd261f8e15d7365db0f816d3433","media_type":"application/vnd.docker.image.rootfs.diff.tar.gzip","size":186},{"digest":"sha256:73389fbd088f5ed5d9fd258baced59de092978b4f483920ea6d074522a105119","media_type":"application/vnd.docker.image.rootfs.diff.tar.gzip","size":6885},{"digest":"sha256:0264850675f7464ed6385d030d281ffb0f2037323c73511a5372948c1c69d92c","media_type":"application/vnd.docker.image.rootfs.diff.tar.gzip","size":2057992898},{"digest":"sha256:de1d03310308c2871217cf179589d5e7fcd8eee31d8f331b61041347f50404a0","media_type":"application/vnd.docker.image.rootfs.diff.tar.gzip","size":64086},{"digest":"sha256:c1d2af7fad0f1c6cdaf09c568c086019e834bc6523c30aa9b2b0b24c4b782086","media_type":"application/vnd.docker.image.rootfs.diff.tar.gzip","size":1683},{"digest":"sha256:5601308b3ac642f7df8b1dc62b9582abdd34857eec6190bcb50162abc5719226","media_type":"application/vnd.docker.image.rootfs.diff.tar.gzip","size":1522},{"digest":"sha256:6b2035e8b73ed2b018995a7b2c8d607d5527daf948d41964f02cc3ce7ed0699a","media_type":"application/vnd.docker.image.rootfs.diff.tar.gzip","size":2989040412},{"digest":"sha256:ed71f8f81b33b96e7112757f6828a6dcb0861026aa63c5edc672d13e11045f6d","media_type":"application/vnd.docker.image.rootfs.diff.tar.gzip","size":88853},{"digest":"sha256:c8ec6bd3d6c3fc8e46f67467d285fd8fbb6877905f1cb78d370956a08e4f9d1d","media_type":"application/vnd.docker.image.rootfs.diff.tar.gzip","size":703562037},{"digest":"sha256:73b52849477a76a807a35e7e717f0a72dcfc72ad268a45b359e55669f49e0394","media_type":"application/vnd.docker.image.rootfs.diff.tar.gzip","size":187118237},{"digest":"sha256:ff17eb64e002f2e9c28007fa3fdedad3267ffab032fb5bf4c92fd3cc1f85d7b7","media_type":"application/vnd.docker.image.rootfs.diff.tar.gzip","size":6106687189},{"digest":"sha256:e587bcf7f8988dcf88e3eee8284e885b5e6c09fc4a3ca4abb67ae4f83419e51b","media_type":"application/vnd.docker.image.rootfs.diff.tar.gzip","size":1510},{"digest":"sha256:4c82cedc00af01e4e453d1f83384fe2691cc15af8210a8a5185c6406015485da","media_type":"application/vnd.docker.image.rootfs.diff.tar.gzip","size":2236},{"digest":"sha256:f4096810b825d849562b134bf531b687dcd7a4b6377c3d93ab65cc84b80e3f45","media_type":"application/vnd.docker.image.rootfs.diff.tar.gzip","size":1657},{"digest":"sha256:5d183ebc167476cfa6ae073ee16fff200b01623aea94ad8b9d437f89555e8603","media_type":"application/vnd.docker.image.rootfs.diff.tar.gzip","size":15326656},{"digest":"sha256:dcd5d23264c4a525906c42348965dc7623bc35a7b881084315e09818432bb779","media_type":"application/vnd.docker.image.rootfs.diff.tar.gzip","size":578374},{"digest":"sha256:434a705eb1a486ec74edc38b46762be3d1cf7c3687629c85dd0615ffbe64a255","media_type":"application/vnd.docker.image.rootfs.diff.tar.gzip","size":661},{"digest":"sha256:515a7516f7d27f33d2796c0097f9d3b1a0df4a708f6d2054b576ff0110ad6644","media_type":"application/vnd.docker.image.rootfs.diff.tar.gzip","size":1412},{"digest":"sha256:749c5a996a2437b4d2139a9d6819e71a8e6b582ab4b3f54c63686b46e2fe4237","media_type":"application/vnd.docker.image.rootfs.diff.tar.gzip","size":2071796891},{"digest":"sha256:c86f852264e82d54fd227220f6c4efcb8c591728d7e3824b4fb109f334f1444a","media_type":"application/vnd.docker.image.rootfs.diff.tar.gzip","size":760},{"digest":"sha256:4f4fb700ef54461cfa02571ae0db9a0dc1e0cdb5577484a6d75e68dc38e8acc1","media_type":"application/vnd.docker.image.rootfs.diff.tar.gzip","size":32}],"platform":"linux/amd64","provider_reference":"unsloth/unsloth@sha256:5266c57be21059bfb407d80dc2f448868a5c2e2dbe7b2aa27780f48b48cbec39","provider_repository":"unsloth/unsloth","registry_repository":"docker.io/unsloth/unsloth","requested_digest":"sha256:5266c57be21059bfb407d80dc2f448868a5c2e2dbe7b2aa27780f48b48cbec39","requested_kind":"manifest","requested_media_type":"application/vnd.docker.distribution.manifest.v2+json"},"lock_id":"191f5df364a3257da02986921bb095b4471f3422cd78a715670bd90c98738879","runtime":{"packages":{"accelerate":"1.12.0","datasets":"4.3.0","huggingface-hub":"0.36.0","numpy":"2.2.6","peft":"0.18.0","safetensors":"0.7.0","torch":"2.9.0+cu128","transformers":"4.57.1","trl":"0.24.0","unsloth":"2026.1.2","unsloth-zoo":"2026.1.2"},"python":"3.11.14","python_implementation":"CPython","signatures":{"TrainerCallback.on_optimizer_step":"(self, args: transformers.training_args.TrainingArguments, state: transformers.trainer_callback.TrainerState, control: transformers.trainer_callback.TrainerControl, **kwargs)","safetensors.safe_open":"(filename, framework, device=Ellipsis)","torch.load":"(f: Union[str, os.PathLike[str], IO[bytes]], map_location: Union[Callable[[torch.types.Storage, str], torch.types.Storage], torch.device, str, dict[str, str], NoneType] = None, pickle_module: Any = None, *, weights_only: Optional[bool] = None, mmap: Optional[bool] = None, **pickle_load_args: Any) -> Any","unsloth.import":"GPU_RUNTIME_REQUIRED"}},"schema_version":"synaptic-hf-training-runtime-lock/v1"}
